Initialization time: 2025-07-02 12:01:41
/nas-ctm01/homes/mipaiva/.conda/envs/pipeline/lib/python3.11/site-packages/albumentations/core/validation.py:87: UserWarning: ShiftScaleRotate is a special case of Affine transform. Please use Affine transform instead.
  original_init(self, **validated_kwargs)
/nas-ctm01/homes/mipaiva/pipeline_template_pl/src/modules/data/data_augmentation/ct_image_augmenter.py:100: UserWarning: Argument(s) 'max_holes, max_height, max_width' are not valid for transform CoarseDropout
  A.CoarseDropout(max_holes=8, max_height=8, max_width=8, p=0.7)
/nas-ctm01/homes/mipaiva/pipeline_template_pl/src/modules/data/data_augmentation/ct_image_augmenter.py:114: UserWarning: Argument(s) 'mean' are not valid for transform GaussNoise
  A.GaussNoise(std_range= (0.1, 0.15), mean = (0.0, 0.0), p=1.0), # Introduces too much noise
/nas-ctm01/homes/mipaiva/pipeline_template_pl/src/modules/data/data_augmentation/ct_image_augmenter.py:41: UserWarning: Argument(s) 'always_apply' are not valid for transform BasicTransform
  super().__init__(always_apply=always_apply, p=p)
/nas-ctm01/homes/mipaiva/pipeline_template_pl/src/modules/data/data_augmentation/ct_image_augmenter.py:133: UserWarning: Argument(s) 'shift_limit' are not valid for transform OpticalDistortion
  A.OpticalDistortion(distort_limit=0.2, shift_limit=0.0, p=0.7)

**************************************************  Experiment 82 | Version 1 **************************************************
Label column '5y' found in metadata. Available columns: ['pid', 'study_yr', 'path', 'sct_slice_num_og', 'stage', '1y', '2y', '5y', '10y', 'fup_days', 'lung_side', 'de_stag', 'de_stag_7thed', 'sct_slice_new', 'sct_nod_err']

✅ Saved split assignments to 'lung_metadata_with_splits.csv'

Using regular DataLoader for train subset
Data Aug
Original shape: 210, New Shape: 316

Using regular DataLoader for train subset
Data Aug
Original shape: 210, New Shape: 316

Using regular DataLoader for train subset
Data Aug
Original shape: 210, New Shape: 316

✅ Set train dataloaders with 3 folds
  - Fold 1: 316 samples
    Label distribution: {0: 158, 1: 158}
    Batch label distribution: {0.0: 36, 1.0: 28}
    Batch label distribution: {0.0: 29, 1.0: 35}
    Batch label distribution: {0.0: 31, 1.0: 33}
    Batch label distribution: {0.0: 32, 1.0: 32}
    Batch label distribution: {0.0: 30, 1.0: 30}
  - Fold 2: 316 samples
    Label distribution: {0: 158, 1: 158}
    Batch label distribution: {0.0: 33, 1.0: 31}
    Batch label distribution: {0.0: 33, 1.0: 31}
    Batch label distribution: {0.0: 29, 1.0: 35}
    Batch label distribution: {0.0: 33, 1.0: 31}
    Batch label distribution: {0.0: 30, 1.0: 30}
  - Fold 3: 316 samples
    Label distribution: {0: 158, 1: 158}
    Batch label distribution: {0.0: 27, 1.0: 37}
    Batch label distribution: {0.0: 35, 1.0: 29}
    Batch label distribution: {0.0: 35, 1.0: 29}
    Batch label distribution: {0.0: 35, 1.0: 29}
    Batch label distribution: {0.0: 26, 1.0: 34}

Using regular DataLoader for validation subset

Using regular DataLoader for validation subset

Using regular DataLoader for validation subset

✅ Set validation dataloaders with 3 folds
  - Fold 1: 105 samples
    Label distribution: {0: 79, 1: 26}
    Batch label distribution: {0.0: 49, 1.0: 15}
    Batch label distribution: {0.0: 30, 1.0: 11}
  - Fold 2: 105 samples
    Label distribution: {0: 79, 1: 26}
    Batch label distribution: {0.0: 52, 1.0: 12}
    Batch label distribution: {0.0: 27, 1.0: 14}
  - Fold 3: 105 samples
    Label distribution: {0: 79, 1: 26}
    Batch label distribution: {0.0: 48, 1.0: 16}
    Batch label distribution: {0.0: 31, 1.0: 10}

Using regular DataLoader for test subset

Using regular DataLoader for test subset

Using regular DataLoader for test subset

✅ Set test dataloaders with 3 folds
  - Fold 1: 79 samples
    Label distribution: {0: 59, 1: 20}
    Batch label distribution: {0.0: 49, 1.0: 15}
    Batch label distribution: {0.0: 10, 1.0: 5}
  - Fold 2: 79 samples
    Label distribution: {0: 59, 1: 20}
    Batch label distribution: {0.0: 49, 1.0: 15}
    Batch label distribution: {0.0: 10, 1.0: 5}
  - Fold 3: 79 samples
    Label distribution: {0: 59, 1: 20}
wandb: Currently logged in as: maria-i-paiva (maria-i-paiva-inesc-tec) to https://api.wandb.ai. Use `wandb login --relogin` to force relogin
wandb: WARNING Using a boolean value for 'reinit' is deprecated. Use 'return_previous' or 'finish_previous' instead.
wandb: Tracking run with wandb version 0.19.11
wandb: Run data is saved locally in /nas-ctm01/homes/mipaiva/pipeline_template_pl/experiment_results/experiment_82/version_1/wandb/run-20250702_120201-nk5f07kl
wandb: Run `wandb offline` to turn off syncing.
wandb: Syncing run resnet18_2d_82_1_fold1
wandb: ⭐️ View project at https://wandb.ai/maria-i-paiva-inesc-tec/best_lung_resnet18_da
wandb: 🚀 View run at https://wandb.ai/maria-i-paiva-inesc-tec/best_lung_resnet18_da/runs/nk5f07kl
    Batch label distribution: {0.0: 49, 1.0: 15}
    Batch label distribution: {0.0: 10, 1.0: 5}

Running model pipeline for data fold 1...
Label column '5y' found in metadata. Available columns: ['pid', 'study_yr', 'path', 'sct_slice_num_og', 'stage', '1y', '2y', '5y', '10y', 'fup_days', 'lung_side', 'de_stag', 'de_stag_7thed', 'sct_slice_new', 'sct_nod_err']
Label weights: tensor([3.0204], device='cuda:0', dtype=torch.float64)
wandb: Finishing previous runs because reinit is set to True.
wandb: uploading output.log; uploading wandb-summary.json; uploading config.yaml
wandb:                                                                                
wandb: 
wandb: Run history:
wandb:          test_accuracy0.25 ▁▁▁▁▁▁▆▁▁▁▁█▂▁█▆█▇▅▇▃▂▃▅▆▇▅█▆▆█▂▆▆▇▇▇▆▆▆
wandb:           test_accuracy0.5 ▁▁█▇███▅▇▆▇█▇▇▇▅█▇▇▇▆▇▆▇▇▆█▇▅▆▆▆▆▆▆▆▅▅▅▅
wandb:          test_accuracy0.75 ███████████████▇▇▄▅▆▄▇██▅▁▆▄▆▅▃▅▃▁▂▁▃▃▂▂
wandb:                 test_auroc █▄▆▆▃▅▆▆▅▅▆████▅▇▇▅▅▁▂▂▃▁▅▃▄▄▂▄▃▃▃▂▄▄▄▃▂
wandb: test_balanced_accuracy0.25 ▃▃▃▃▃▃▃▃▃▃▃▃▁▃▃▆▅▆█▃▄▅▆▃▆▇▄▅▄▄▃▂▄▃▅▅▅▃▂▂
wandb:  test_balanced_accuracy0.5 ▅▄▄▄▄█▇▄▇▇▅▆▇▆▅█▄▄▅▅▅▅▆▂▃▂▃▂▃▁▄▅▄▃▄▃▃▃▃▃
wandb: test_balanced_accuracy0.75 ▅▅▅▅▅▅▆▅▅▅█▇▆▅▅▄▅▅▅▄▃▇▆▅▄▇▇▇▄▃▂▃▁▃▄▄▄▄▄▄
wandb:         test_precision0.25 ▂▂▂▂▂▂▂▂▂▂▂▅▃█▄▆▆▇▃▇▂▃▃▂▂▃▂▄▅▄▆▆▁▁▄▂▄▃▁▁
wandb:          test_precision0.5 ▅▄▄▆▁▅▅▁█▇▅▇▅▅▄▅▅▅▅▆▄▅▅▃▃▄▃▃▄▄▅▂▃▃▂▄▄▃▃▃
wandb:         test_precision0.75 ▁▁▁▁▁▁▁▁▁▁▁▁▄█▄▃▄▂▄▄▅▅▂▃▃▃▃▁▄▃▂▃▃▂▁▂▃▃▂▃
wandb:            test_recall0.25 █████▃▃▆▆▃▅▃▄▃▅▄▅▃▇▃▁▁▃▃▃▅▃▄▃▅▄▄▃▄▄▄▄▄▃▃
wandb:             test_recall0.5 █▁▁█▇▁▁▂▂▁▃▃▃▁▃▃▂▄▃▃▂▂▂▂▁▂▃▃▂▃▂▃▄▄▃▃▂▃▃▃
wandb:            test_recall0.75 ▁▁▁▁▁▁▁▁▁▁▁▁▁▁▁▁▅▁▂█▇▅▆▄▄▁▂▃▇▆▁▁▃▂▅▇▄▇▅▅
wandb:                train_auroc ▂▃▂▁▂▄▄▅▅▆████▆▅████▇▇██████████████████
wandb:                 train_loss ██▇█▇████▇▆▆▆▃▂▂▂▂▂▂▅▄▄▄▂▁▁▁█▅▄▃▂▁▁▁▁▁▁▁
wandb:           val_accuracy0.25 ▁▁▁▁▁▁▁▁▁▁▂▁▂▆▅▆█▇▅▇▄▆▄▄▃█▇▆▅▇▄▇▇▇▇▆▆▅▇▆
wandb:            val_accuracy0.5 ▁▁▁▅██▄████▇▇█▇▅█▅▆▅▅▄▇▇▆▇▇▆▅▅▅▇▆▇▆▆▆▅▅▆
wandb:           val_accuracy0.75 █▅▇▇▇▇▇██▇█▄▄▆▃▄▄▂▅▄▇▇▆▄▄▄▁▇▇▄▄▄▆▅▃▃▂▁▂▄
wandb:                  val_auroc █▇▇█▅▇▅█▇▆▅▄▃▃▃▄▆▄▃▃▅▅▄▄▄▅▁▁▁▂▂▂▃▃▄▄▄▄▄▄
wandb:  val_balanced_accuracy0.25 ▇▇▇▇▇▇▇▇▇▇▇▆█▃▆▄▆▇▇▄▁▅▇▇▇▆▅▃▃▃▆▆▆▆▆▆▆▄▇▆
wandb:   val_balanced_accuracy0.5 ▅▆▇▆█▆▆█▄▅▆▃█▄▂▃▅▅▃▆▇▂▃▃▃▁▁▅▄▄▃▇▅▅▄▄▅▄▅▅
wandb:  val_balanced_accuracy0.75 ▅▅▅▅▅█▇▅▅▅▃▇▇▅▆▆▅▆▅█▂▁▂▂▂▃▃▃▄▂▆▂▁▁▆▆▅▅▆▆
wandb:          val_precision0.25 ███████████▇▇▇▄▆█▆▇▅▄█▇█▃▆▃▁▂▄▅▆▅▅█▇▇▅▆▆
wandb:           val_precision0.5 █▄▁▁▃▃▂▂▃▃▃▃▃▃▄▃▃▃▃▃▂▂▅▃▃▂▂▂▂▂▂▂▂▂▃▃▂▂▃▃
wandb:          val_precision0.75 ▁▁█▁▁▁▁▁▁▁█▅▃▃▃▃▃▂▂▂▂▂▃▁▂▃▃▄▂▂▂▂▂▁▂▂▃▂▃▃
wandb:             val_recall0.25 ███████████▃▂▂▂▂▁▂▂▂▁▁▄▂▂▂▁▂▂▃▂▂▂▄▃▃▃▂▂▂
wandb:              val_recall0.5 ▁▁▁█▁▃▂▂▁▂▂▃▂▂▂▅▂▃▁▂▃▃▂▁▂▂▂▂▂▂▂▃▂▃▂▃▃▃▃▃
wandb:             val_recall0.75 ▁▁▅▁▁▁▁▁▁▁▅▂▅▂▄▅▅▅▅▅▁▃▄▂▂▅▁▁▇▃▄▂▆▆▅▆██▇▆
wandb: 
wandb: Run summary:
wandb:          test_accuracy0.25 0.5443
wandb:           test_accuracy0.5 0.56962
wandb:          test_accuracy0.75 0.59494
wandb:                 test_auroc 0.45127
wandb: test_balanced_accuracy0.25 0.48008
wandb:  test_balanced_accuracy0.5 0.46398
wandb: test_balanced_accuracy0.75 0.46441
wandb:         test_precision0.25 0.23333
wandb:          test_precision0.5 0.20833
wandb:         test_precision0.75 0.2
wandb:            test_recall0.25 0.35
wandb:             test_recall0.5 0.25
wandb:            test_recall0.75 0.2
wandb:                train_auroc 0.99914
wandb:                 train_loss 0.06769
wandb:           val_accuracy0.25 0.55238
wandb:            val_accuracy0.5 0.6
wandb:           val_accuracy0.75 0.6381
wandb:                  val_auroc 0.41285
wandb:  val_balanced_accuracy0.25 0.4703
wandb:   val_balanced_accuracy0.5 0.48905
wandb:  val_balanced_accuracy0.75 0.50146
wandb:          val_precision0.25 0.21622
wandb:           val_precision0.5 0.23333
wandb:          val_precision0.75 0.25
wandb:             val_recall0.25 0.30769
wandb:              val_recall0.5 0.26923
wandb:             val_recall0.75 0.23077
wandb: 
wandb: 🚀 View run resnet18_2d_82_1_fold1 at: https://wandb.ai/maria-i-paiva-inesc-tec/best_lung_resnet18_da/runs/nk5f07kl
wandb: ⭐️ View project at: https://wandb.ai/maria-i-paiva-inesc-tec/best_lung_resnet18_da
wandb: Synced 5 W&B file(s), 0 media file(s), 0 artifact file(s) and 0 other file(s)
wandb: Find logs at: /nas-ctm01/homes/mipaiva/pipeline_template_pl/experiment_results/experiment_82/version_1/wandb/run-20250702_120201-nk5f07kl/logs
wandb: Tracking run with wandb version 0.19.11
wandb: Run data is saved locally in /nas-ctm01/homes/mipaiva/pipeline_template_pl/experiment_results/experiment_82/version_1/wandb/run-20250702_122851-acgzbbu1
wandb: Run `wandb offline` to turn off syncing.
wandb: Syncing run resnet18_2d_82_1_fold2
wandb: ⭐️ View project at https://wandb.ai/maria-i-paiva-inesc-tec/best_lung_resnet18_da
wandb: 🚀 View run at https://wandb.ai/maria-i-paiva-inesc-tec/best_lung_resnet18_da/runs/acgzbbu1
...model pipeline for data fold 1 has run!

Running model pipeline for data fold 2...
Label column '5y' found in metadata. Available columns: ['pid', 'study_yr', 'path', 'sct_slice_num_og', 'stage', '1y', '2y', '5y', '10y', 'fup_days', 'lung_side', 'de_stag', 'de_stag_7thed', 'sct_slice_new', 'sct_nod_err']
Label weights: tensor([3.0204], device='cuda:0', dtype=torch.float64)
wandb: Finishing previous runs because reinit is set to True.
wandb:                                                                                
wandb: 
wandb: Run history:
wandb:          test_accuracy0.25 ▁▁▁▁▂▁▁▁▁▂▃▂▄▆▅▁▂▅▄▄▃▅▅▅▅▂█▆▇▁▁▁▁▁▁▁▁▁▁▁
wandb:           test_accuracy0.5 █▁███▂████████▇▁▆▆▇███▇█▇█▇▁▁▁▁▁▁▁▁▁▁▁▁▁
wandb:          test_accuracy0.75 ▇▇▇▇▇▇▇▇▇▇▁▇▇▇▅▇▅▇▇▇▇▇▇▇▇▇▇███▇▇▇▇▇▇▇▇▇▇
wandb:                 test_auroc ▂▁▂▂▁▃▃▃▃▂▁▃▃▂▂▃▃▁█▆▃▂▂▂▂▁▁▁▁▁▁▁▁▁▁▁▁▁▁▁
wandb: test_balanced_accuracy0.25 ▃▃▃▃▃▃▃▃▃▃▃▃▅▄▄██▅▃▃▂▆▃▄▆▄▁▃▃▃▃▃▃▃▃▃▃▃▃▃
wandb:  test_balanced_accuracy0.5 █▂▂▂▅▅▁▂█▂▅▅▄▄▂▅▇▆▅▃▂▂▂▂▂▂▂▂▂▂▂▂▂▂▂▂▂▂▂▂
wandb: test_balanced_accuracy0.75 ▅▅▅▅▅▅▅▅█▅█▆▅▁▅▅▅▅▅▅▅▄▅▅▅▅▅▅▅▅▅▅▅▅▅▅▅▅▅▅
wandb:         test_precision0.25 ▂▂▂▂▂▁▂▂▂▂▃▂▇▄▄▃▂▃▃▁▂▃▂█▄▂▂▂▂▂▂▂▂▂▂▂▂▂▂▂
wandb:          test_precision0.5 ▁▅▃▃▁▁▁▁▁▁▅▂▁▃▃▁▁▄▁▅▅▅▃▅▅▃█▃▃▃▃▃▃▃▃▃▃▃▃▃
wandb:         test_precision0.75 ▁▁▁▁▁▁▁▁▁▅▁▁▂▁▁▁▁▁▁▁▁▁▅██▁▁▁▁▁▁▁▁▁▁▁▁▁▁▁
wandb:            test_recall0.25 ██████████▇▆▂▇▇█▄▄▅▂▃▂▂▅▁▂▁█████████████
wandb:             test_recall0.5 ▁▁▅▁▁▃▃▁▁▃▁▁▁▃▁▁▁█▅▅▃▂▁▂▂▄▂▂▂▂▃▃▃███████
wandb:            test_recall0.75 ▁▁▁▁▁▁▁▁▁█▁▁▁▁▁▁▁▁▁▃▁▃▁▁▁▁▁▁▁▁▁▁▁▁▁▁▁▁▁▁
wandb:                train_auroc ▂▂▃▄▃▄▅▆▅▆▆▇▇▇▅▆▆▆▅▅▇▇▇█▇███▂▁▃▁▁▂▂▂▂▁▁▁
wandb:                 train_loss ▃▃▃▃▃▃▅▃▂▂▁▃▃█▂▂▃▃▂▂▁▂▁▁▁▃▃▃▃▃▃▃▃▃▃▃▃▃▃▃
wandb:           val_accuracy0.25 ▁▁▁▁▁▁▁▂▁▃▃▆▄▃▁▂▅▅▁█▄▄▅▅▅▆▄▆▆▁▁▁▁▁▁▁▁▁▁▁
wandb:            val_accuracy0.5 █▁█▇▆██▆▆▇█▅█▅█▇▇█▇█▇▆▇▇▂▁▁▁▁▁▁▁▁▁▁▁▁▁▁▁
wandb:           val_accuracy0.75 ▄▄▄▄▄▄▄▄▂▂▄█▂▄▄▄▄▄▁▁▄▄▄▄▄▄▄▄▄▄▄▄▄▄▄▄▄▄▄▄
wandb:                  val_auroc █▇███▇▇▇▇▆▁▄▄▆▅▃▅▅▃▄▃▃▃▂▄▅▅▅▅▅▅▅▅▅▅▅▅▅▅▅
wandb:  val_balanced_accuracy0.25 ▆▆▆▆▆▆▆▆▃█▅▅▇▆▆▅▆▇▁▄▄▄▃▂▆▄▃▃▁▆▆▆▆▆▆▆▆▆▆▆
wandb:   val_balanced_accuracy0.5 ▃█▃▇▄▅▃▃▃▅▄▅▃▃█▃▃▁▄▃▆▂▃▃▃▃▃▃▃▃▃▃▃▃▃▃▃▃▃▃
wandb:  val_balanced_accuracy0.75 ▅▅▅▅▅▅▅▅▆▆▅▆▆▇▅▁▆▅▅▅▅▆▅▅▅█▅▆▆▇▅▅▅▅▅▅▅▅▅▅
wandb:          val_precision0.25 ▇▇▇▇▇▇▇▇▇▇▅▆▄█▇▇▅▃▄▃▄▁▅▆▂▇▇▇▇▇▇▇▇▇▇▇▇▇▇▇
wandb:           val_precision0.5 ▁▁▄▃▂▁▁▃▁▃▄▃▁▅▁█▁▁▁▁▂▂▅▃▃▃▃▃▃▃▃▃▃▃▃▃▃▃▃▃
wandb:          val_precision0.75 ▁▁▁▁▁▁▁▁▁▁▁▁▂▂▃▃▅▁▁█▁▁▁▁▁▅▁▁▁▁▁▁▁▁▁▁▁▁▁▁
wandb:             val_recall0.25 █████████████▂▆▁▅▅█▁▆▂▃▅▂▃▃█████████████
wandb:              val_recall0.5 █▁▁▆▂▂▂█▂▁▁▁▇▁▂▂▂▃▃██▄▁▁▁▁▁▁▁▁▁▁▂███████
wandb:             val_recall0.75 ▁▁▁▁▁▁▁▁▁▁▃▁▃▆█▃▁▆▁▁▁▁▁▃▅▅▁▁▁▁▁▁▁▁▁▁▁▁▁▁
wandb: 
wandb: Run summary:
wandb:          test_accuracy0.25 0.25316
wandb:           test_accuracy0.5 0.25316
wandb:          test_accuracy0.75 0.74684
wandb:                 test_auroc 0.5
wandb: test_balanced_accuracy0.25 0.5
wandb:  test_balanced_accuracy0.5 0.5
wandb: test_balanced_accuracy0.75 0.5
wandb:         test_precision0.25 0.25316
wandb:          test_precision0.5 0.25316
wandb:         test_precision0.75 0
wandb:            test_recall0.25 1
wandb:             test_recall0.5 1
wandb:            test_recall0.75 0
wandb:                train_auroc 0.47468
wandb:                 train_loss 2.09363
wandb:           val_accuracy0.25 0.24762
wandb:            val_accuracy0.5 0.24762
wandb:           val_accuracy0.75 0.75238
wandb:                  val_auroc 0.5
wandb:  val_balanced_accuracy0.25 0.5
wandb:   val_balanced_accuracy0.5 0.5
wandb:  val_balanced_accuracy0.75 0.5
wandb:          val_precision0.25 0.24762
wandb:           val_precision0.5 0.24762
wandb:          val_precision0.75 0
wandb:             val_recall0.25 1
wandb:              val_recall0.5 1
wandb:             val_recall0.75 0
wandb: 
wandb: 🚀 View run resnet18_2d_82_1_fold2 at: https://wandb.ai/maria-i-paiva-inesc-tec/best_lung_resnet18_da/runs/acgzbbu1
wandb: ⭐️ View project at: https://wandb.ai/maria-i-paiva-inesc-tec/best_lung_resnet18_da
wandb: Synced 5 W&B file(s), 0 media file(s), 0 artifact file(s) and 0 other file(s)
wandb: Find logs at: /nas-ctm01/homes/mipaiva/pipeline_template_pl/experiment_results/experiment_82/version_1/wandb/run-20250702_122851-acgzbbu1/logs
wandb: Tracking run with wandb version 0.19.11
wandb: Run data is saved locally in /nas-ctm01/homes/mipaiva/pipeline_template_pl/experiment_results/experiment_82/version_1/wandb/run-20250702_125856-ent8pmbt
wandb: Run `wandb offline` to turn off syncing.
wandb: Syncing run resnet18_2d_82_1_fold3
wandb: ⭐️ View project at https://wandb.ai/maria-i-paiva-inesc-tec/best_lung_resnet18_da
wandb: 🚀 View run at https://wandb.ai/maria-i-paiva-inesc-tec/best_lung_resnet18_da/runs/ent8pmbt
...model pipeline for data fold 2 has run!

Running model pipeline for data fold 3...
Label column '5y' found in metadata. Available columns: ['pid', 'study_yr', 'path', 'sct_slice_num_og', 'stage', '1y', '2y', '5y', '10y', 'fup_days', 'lung_side', 'de_stag', 'de_stag_7thed', 'sct_slice_new', 'sct_nod_err']
Label weights: tensor([3.0204], device='cuda:0', dtype=torch.float64)
wandb: uploading config.yaml
wandb:                                                                                
wandb: 
wandb: Run history:
wandb:          test_accuracy0.25 ▁▁▁▁▁▁▁▁▁▁▁▁▁▁▁█▁▁▁▁▁▁▁▁▁▁▁▁▁▁▁▁▁▁▁▁▁▁▁▁
wandb:           test_accuracy0.5 ▁██▁▁▁▁█▁▄▂█▆▇█▆▁██████████████████▁█▅█▁
wandb:          test_accuracy0.75 ▁▁▁▁▁▁▁▁▁▁▁▁▁▁▁▁▁▁▁▁▁▁▁▁▁▁▁▁▁▁▁▁▁▁▁▁▁▁▁▁
wandb:                 test_auroc ▄▆▄▅▅▅▅▄▅▅▅▅▅▅▆▆▇▇▇█▁▅▄▆▄▆▃▁▂▃▃▂▂▃▂▂▂▂▁▅
wandb: test_balanced_accuracy0.25 ▁▁▁▁▁▁▁▁▁▁▁▁▁▁▁▁▁▁▁▁▁▁▁▁▁▁▁▁▁▁▁▁▁▁▁▁▁▁▁▁
wandb:  test_balanced_accuracy0.5 ▆▆▆▆▆▁▇▆▆▆▆▆▆▇▁█▆▆▆▂▂▆▆▆▆▆▆▆▆▆▆▆▆▆▆▆▆▆▇▆
wandb: test_balanced_accuracy0.75 ▁▁▁▁▁▁▁▁▁▁▃▁▁▁▁▁▁▁▁▁▁▁▁▁▁▁▁▁▁▁▁▁▁▁▁▁▁▁█▁
wandb:         test_precision0.25 █████████████████████████████████████▇█▁
wandb:          test_precision0.5 ▁▁▁▄▃▃▅▁▃▃▄▄▁▄▁▃▁▁▃▁▁▁▁▁▁▁▁▁▁▁▁▁▁▁▁▁▁█▁▃
wandb:         test_precision0.75 ▁▁▁▁▁▁▁▁▁▁▁▁▁▁▁▁▁▁▁▁▁▁▁▁▁▁▁▁▁▁▁▁▁▁▁▅▁█▁▁
wandb:            test_recall0.25 ██████████▃▃███▁████████████████████████
wandb:             test_recall0.5 █▁▂▁█▁███▁█▁▃▃▆▁▁▁▁▁█▇▁▁▁▁▁▁▁▁▁▁▁▁▁▃▁█▁▁
wandb:            test_recall0.75 ▁▁▁▁▁▁█▁█▁▁▁▁▁█▁▁▁▁▁▁▁▁▁▁▁▁▁▁▁▁▁▁▁▁▁▁▁▁▁
wandb:                train_auroc ▂▃▁▂▄▅▅▄▅▄▆▅▆▆██▃▃▃▃▂▂▃▂▄▃▂▂▂▃▃▃▃▄▂▅▃▃▅▇
wandb:                 train_loss ▆▆█▇▆▆▅▅▅▄▄▂▄▃▁▇▇▆▆▇▇▇▇▇▇▇▇▇▇▇▇▇▇▇▇▇▆▇▇▆
wandb:           val_accuracy0.25 ▁▁▁▁▁▁▁▁▂▂█▃▁▁▁▁▁▁▁▁▁▁▁▁▁▁▁▁▁▁▁▁▁▁▁▁▁▁▁▁
wandb:            val_accuracy0.5 █▇▃█▁▁▁▂█▃█▇▆▇█▆▆██▂███████████████████▁
wandb:           val_accuracy0.75 ███████████▁█████████████████████▁██████
wandb:                  val_auroc ▇▇▇▇█▇▇▇▇▇▇▆▅▁▆▃██▇▆▇▃▅█▇▅▆▇▇▇▇█████▇▇█▁
wandb:  val_balanced_accuracy0.25 ▆▆▆▆▆▆▆▆▆▆▆▆█▆▆▁▆▆▆▆▆▆▆▆▆▆▆▆▆▆▆▆▆▆▆▆▆▆▆▆
wandb:   val_balanced_accuracy0.5 ▂▆█▂▆▂▂▂▂▂▃▂▁▃▁▇▂▂▂▆▂▂▄▂▂▂▂▂▂▂▂▂▂▂▂▂▂▂▂▂
wandb:  val_balanced_accuracy0.75 ▃▃▃▃▃▃▃▃▃▃▃▃▃▃▃▁▅▃█▃▃▃▃▃▃▃▃▃▃▃▃▃▃▃▃▃▃▃▃▃
wandb:          val_precision0.25 ▆▆▆▆▆▆▆▆▆▆▆▆▆▆█▆▆▁▆▆▆▆▆▆▆▆▆▆▆▆▆▆▆▆▆▆▆▆▆▆
wandb:           val_precision0.5 ▄▁▄▄▅▄▅▄▄▄▄▅▆▁█▁▄▁▁▁▁▁▁▁▁▁▁▁▁▁▁▁▁▁▁▁▁▇▁▁
wandb:          val_precision0.75 ▁▁▁▁▁▁▁▁▁▁▁▁▁▁▁▁▁▁▁▁▁▁▁▁▁▁▁▁▁▁▁▁▁▁▁▁▁▁▁▁
wandb:             val_recall0.25 ▁▁▁▁▁▁▁▁▁▁▁▁▁▁▁▁▁▁▁▁▁▁▁▁▁▁▁▁▁▁▁▁▁▁▁▁▁▁▁▁
wandb:              val_recall0.5 ▄▆▇█▁█▆▇▁▁▄▁▁▁█▁▁▁▁▁▁▁▁▁▁▁▁▁▁▁▁▁▁▁▁▁▅▁▁█
wandb:             val_recall0.75 ▁▁▁▁▁▁▁▁▁▁▁▁█▁▁▁▁▁▁▁▁▁▁▁▁▁▁▁▁▁▁▁▁▁▁█▁▁▁▁
wandb: 
wandb: Run summary:
wandb:          test_accuracy0.25 0.25316
wandb:           test_accuracy0.5 0.74684
wandb:          test_accuracy0.75 0.74684
wandb:                 test_auroc 0.53983
wandb: test_balanced_accuracy0.25 0.5
wandb:  test_balanced_accuracy0.5 0.5
wandb: test_balanced_accuracy0.75 0.5
wandb:         test_precision0.25 0.25316
wandb:          test_precision0.5 0
wandb:         test_precision0.75 0
wandb:            test_recall0.25 1
wandb:             test_recall0.5 0
wandb:            test_recall0.75 0
wandb:                train_auroc 0.62053
wandb:                 train_loss 2.0457
wandb:           val_accuracy0.25 0.24762
wandb:            val_accuracy0.5 0.75238
wandb:           val_accuracy0.75 0.75238
wandb:                  val_auroc 0.51339
wandb:  val_balanced_accuracy0.25 0.5
wandb:   val_balanced_accuracy0.5 0.5
wandb:  val_balanced_accuracy0.75 0.5
wandb:          val_precision0.25 0.24762
wandb:           val_precision0.5 0
wandb:          val_precision0.75 0
wandb:             val_recall0.25 1
wandb:              val_recall0.5 0
wandb:             val_recall0.75 0
wandb: 
wandb: 🚀 View run resnet18_2d_82_1_fold3 at: https://wandb.ai/maria-i-paiva-inesc-tec/best_lung_resnet18_da/runs/ent8pmbt
wandb: ⭐️ View project at: https://wandb.ai/maria-i-paiva-inesc-tec/best_lung_resnet18_da
wandb: Synced 5 W&B file(s), 0 media file(s), 0 artifact file(s) and 0 other file(s)
wandb: Find logs at: /nas-ctm01/homes/mipaiva/pipeline_template_pl/experiment_results/experiment_82/version_1/wandb/run-20250702_125856-ent8pmbt/logs
...model pipeline for data fold 3 has run!
Saving execution datetimes to /nas-ctm01/homes/mipaiva/pipeline_template_pl/experiment_results/experiment_82/version_1/execution_datetimes.json
Finish time: 2025-07-02 13:16:20
