Initialization time: 2025-05-27 23:54:50
wandb: Currently logged in as: maria-i-paiva (maria-i-paiva-inesc-tec) to https://api.wandb.ai. Use `wandb login --relogin` to force relogin
wandb: WARNING Using a boolean value for 'reinit' is deprecated. Use 'return_previous' or 'finish_previous' instead.
wandb: Tracking run with wandb version 0.19.11
wandb: Run data is saved locally in /nas-ctm01/homes/mipaiva/pipeline_template_pl/experiment_results/experiment_122/version_1/wandb/run-20250527_235459-gr0s29jq
wandb: Run `wandb offline` to turn off syncing.
wandb: Syncing run resnet50_3d_122_1_fold1
wandb: ⭐️ View project at https://wandb.ai/maria-i-paiva-inesc-tec/comparative_study_3d_norm_resize
wandb: 🚀 View run at https://wandb.ai/maria-i-paiva-inesc-tec/comparative_study_3d_norm_resize/runs/gr0s29jq

**************************************************  Experiment 122 | Version 1 **************************************************
Label column '5y' found in metadata. Available columns: ['pid', 'study_yr', 'path', 'sct_slice_num_og', 'stage', '1y', '2y', '5y', '10y', 'fup_days', 'sct_nod_err']
[INFO] Train dataloader 0 label distribution: 0: 216, 1: 72
[INFO] Validation dataloader 0 label distribution: 0: 24, 1: 8
[INFO] Test dataloader 0 label distribution: 0: 60, 1: 20

Running model pipeline for data fold 1...
Label column '5y' found in metadata. Available columns: ['pid', 'study_yr', 'path', 'sct_slice_num_og', 'stage', '1y', '2y', '5y', '10y', 'fup_days', 'sct_nod_err']
/nas-ctm01/homes/mipaiva/.conda/envs/pipeline/lib/python3.11/site-packages/torchmetrics/utilities/prints.py:43: UserWarning: No negative samples in targets, false positive value should be meaningless. Returning zero tensor in false positive score
  warnings.warn(*args, **kwargs)
/nas-ctm01/homes/mipaiva/.conda/envs/pipeline/lib/python3.11/site-packages/torchmetrics/utilities/prints.py:43: UserWarning: No positive samples in targets, true positive value should be meaningless. Returning zero tensor in true positive score
  warnings.warn(*args, **kwargs)
/nas-ctm01/homes/mipaiva/.conda/envs/pipeline/lib/python3.11/site-packages/sklearn/metrics/_classification.py:407: UserWarning: A single label was found in 'y_true' and 'y_pred'. For the confusion matrix to have the correct shape, use the 'labels' parameter to pass all known labels.
  warnings.warn(
wandb:                                                                                
wandb: 
wandb: Run history:
wandb:          test_accuracy ▁▁▁▁▁▁▁▁▁▁▁▁▁▁▁▁▁▁▁▁▁▁▁▁▁▁▁▁▁▁▁▁▁▁▁▁▁▁▁▁
wandb:             test_auroc ▁▇▃▂▆▇▇▁█▃▁▅▇▂▃▇▇███▂▃▇▂▇▆▇▆▇▇▁▂▆▃▅▅▁▂▄▅
wandb: test_balanced_accuracy ▁▁▁▁▁▁▁▁▁▁▁▁▁▁▁▁▁▁▁▁▁▁▁▁▁▁▁▁▁▁▁▁▁▁▁▁▁▁▁▁
wandb:         test_precision ▁███████████████████████████████████████
wandb:            test_recall ▂█▁█████████████████████████████████████
wandb:            train_auroc ▄▇▄▅▆▄▄▂▅▄▅▄▅▂▄▃▅▄▄▃▄▃▆▃▆▃▄▂▂▆▄▅▄▂▄▅▁▆▃█
wandb:             train_loss █▂▂▂▂▂▂▂▂▁▂▁▂▁▁▁▂▂▂▂▂▁▂▁▁▂▁▁▁▂▂▁▁▂▂▁▂▁▂▁
wandb:           val_accuracy ▁▁▁▁▁▁▁▁▁▁▁▁▁▁▁▁▁▁▁▁▁▁▁▁▁▁▁▁▁▁▁▁▁▁▁▁▁▁▁▁
wandb:              val_auroc ▅▅▃▃▆▅▇▆▂▅▆▆▁▁▆▂▆█▄▆▂▂▃▂▆▅▅▅▄▄▇▂▆▇▄▁▁▁▃█
wandb:  val_balanced_accuracy ▁▁▁▁▁▁▁▁▁▁▁▁▁▁▁▁▁▁▁▁▁▁▁▁▁▁▁▁▁▁▁▁▁▁▁▁▁▁▁▁
wandb:               val_loss █▁▃▂▁▁▁▁▁▁▁▁▁▁▁▁▁▁▁▁▁▁▁▁▁▁▁▁▁▁▁▁▁▁▁▁▁▁▁▁
wandb:          val_precision ▁▁▁▁▁▁▁▁▁▁▁▁▁▁▁▁▁▁▁▁▁▁▁▁▁▁▁▁▁▁▁▁▁▁▁▁▁▁▁▁
wandb:             val_recall ▁███████████████████████████████████████
wandb: 
wandb: Run summary:
wandb:          test_accuracy 0.75
wandb:             test_auroc 0.51562
wandb: test_balanced_accuracy 0.5
wandb:         test_precision 0.75
wandb:            test_recall 0.75
wandb:            train_auroc 0.52665
wandb:             train_loss 0.64683
wandb:           val_accuracy 0.75
wandb:              val_auroc 0.62891
wandb:  val_balanced_accuracy 0.5
wandb:               val_loss 0.66535
wandb:          val_precision 0.75
wandb:             val_recall 0.75
wandb: 
wandb: 🚀 View run resnet50_3d_122_1_fold1 at: https://wandb.ai/maria-i-paiva-inesc-tec/comparative_study_3d_norm_resize/runs/gr0s29jq
wandb: ⭐️ View project at: https://wandb.ai/maria-i-paiva-inesc-tec/comparative_study_3d_norm_resize
wandb: Synced 5 W&B file(s), 0 media file(s), 0 artifact file(s) and 0 other file(s)
wandb: Find logs at: /nas-ctm01/homes/mipaiva/pipeline_template_pl/experiment_results/experiment_122/version_1/wandb/run-20250527_235459-gr0s29jq/logs
wandb: Tracking run with wandb version 0.19.11
wandb: Run data is saved locally in /nas-ctm01/homes/mipaiva/pipeline_template_pl/experiment_results/experiment_122/version_2/wandb/run-20250528_030423-mm066d2r
wandb: Run `wandb offline` to turn off syncing.
wandb: Syncing run resnet50_3d_122_2_fold1
wandb: ⭐️ View project at https://wandb.ai/maria-i-paiva-inesc-tec/comparative_study_3d_norm_resize
wandb: 🚀 View run at https://wandb.ai/maria-i-paiva-inesc-tec/comparative_study_3d_norm_resize/runs/mm066d2r
...model pipeline for data fold 1 has run!
Saving execution datetimes to /nas-ctm01/homes/mipaiva/pipeline_template_pl/experiment_results/experiment_122/version_1/execution_datetimes.json

**************************************************  Experiment 122 | Version 2 **************************************************
Label column '5y' found in metadata. Available columns: ['pid', 'study_yr', 'path', 'sct_slice_num_og', 'stage', '1y', '2y', '5y', '10y', 'fup_days', 'sct_nod_err']
[INFO] Train dataloader 0 label distribution: 0: 216, 1: 72
[INFO] Validation dataloader 0 label distribution: 0: 24, 1: 8
[INFO] Test dataloader 0 label distribution: 0: 60, 1: 20

Running model pipeline for data fold 1...
Label column '5y' found in metadata. Available columns: ['pid', 'study_yr', 'path', 'sct_slice_num_og', 'stage', '1y', '2y', '5y', '10y', 'fup_days', 'sct_nod_err']
/nas-ctm01/homes/mipaiva/.conda/envs/pipeline/lib/python3.11/site-packages/torchmetrics/utilities/prints.py:43: UserWarning: No negative samples in targets, false positive value should be meaningless. Returning zero tensor in false positive score
  warnings.warn(*args, **kwargs)
/nas-ctm01/homes/mipaiva/.conda/envs/pipeline/lib/python3.11/site-packages/torchmetrics/utilities/prints.py:43: UserWarning: No positive samples in targets, true positive value should be meaningless. Returning zero tensor in true positive score
  warnings.warn(*args, **kwargs)
/nas-ctm01/homes/mipaiva/.conda/envs/pipeline/lib/python3.11/site-packages/sklearn/metrics/_classification.py:407: UserWarning: A single label was found in 'y_true' and 'y_pred'. For the confusion matrix to have the correct shape, use the 'labels' parameter to pass all known labels.
  warnings.warn(
wandb:                                                                                
wandb: 
wandb: Run history:
wandb:          test_accuracy █▁██████████████████████████████████████
wandb:             test_auroc ▆▅▇▆▄▅▇▅▅▇▇▆▅▄█▆▆▆▇▇▂▄▁▂▅▇▃▆▁▃▂▂▂▂▄▅▆▃▅▆
wandb: test_balanced_accuracy ▁▁▁▁▁▁▁▁▁▁▁▁▁▁▁▁▁▁▁▁▁▁▁▁▁▁▁▁▁▁▁▁▁▁▁▁▁▁▁▁
wandb:         test_precision ▁███████████████████████████████████████
wandb:            test_recall ▁▁▁▁▁▁▁▁▁▁▁▁▁▁▁▁▁▁▁▁▁▁▁▁▁▁▁▁▁▁▁▁▁▁▁▁▁▁▁▁
wandb:            train_auroc ▄▆▄▅█▅▃▄▅▃▆▅▅▂▄▃▃▃▃▃▁▃▃▂▆▇▄▆▃▄▅▅▂▃▅▃▃▄▃▂
wandb:             train_loss █▂▂▂▂▂▂▂▂▂▂▂▂▂▁▂▂▂▂▂▂▁▂▂▂▅▁▁▂▂▂▁▂▂▂▂▃▂▁▂
wandb:           val_accuracy █▁██████████████████████████████████████
wandb:              val_auroc █▃▅▃▃▁▃▄▄▃▇▇▄▅▄▅▇▂▂█▃▆▆▇▃▄▁▂▁▃▃▂▅▅▆▅▅▄▅▅
wandb:  val_balanced_accuracy ▁▁▁▁▁▁▁▁▁▁▁▁▁▁▁▁▁▁▁▁▁▁▁▁▁▁▁▁▁▁▁▁▁▁▁▁▁▁▁▁
wandb:               val_loss ▁▂▅█▁▁▁▁▁▂▂▁▁▁▂▁▂▂▁▁▁▂▁▂▁▁▂▂▂▁▁▁▁▁▅▂▂▂▁▁
wandb:          val_precision ▁▁▁▁▁▁▁▁▁▁▁▁▁▁▁▁▁▁▁▁▁▁▁▁▁▁▁▁▁▁▁▁▁▁▁▁▁▁▁▁
wandb:             val_recall ▁▁▁▁▁▁▁▁▁▁▁▁▁▁▁▁▁▁▁▁▁▁▁▁▁▁▁▁▁▁▁▁▁▁▁▁▁▁▁▁
wandb: 
wandb: Run summary:
wandb:          test_accuracy 0.75
wandb:             test_auroc 0.58229
wandb: test_balanced_accuracy 0.5
wandb:         test_precision 0.75
wandb:            test_recall 0.75
wandb:            train_auroc 0.41663
wandb:             train_loss 0.65424
wandb:           val_accuracy 0.75
wandb:              val_auroc 0.48958
wandb:  val_balanced_accuracy 0.5
wandb:               val_loss 0.66298
wandb:          val_precision 0.75
wandb:             val_recall 0.75
wandb: 
wandb: 🚀 View run resnet50_3d_122_2_fold1 at: https://wandb.ai/maria-i-paiva-inesc-tec/comparative_study_3d_norm_resize/runs/mm066d2r
wandb: ⭐️ View project at: https://wandb.ai/maria-i-paiva-inesc-tec/comparative_study_3d_norm_resize
wandb: Synced 5 W&B file(s), 0 media file(s), 0 artifact file(s) and 0 other file(s)
wandb: Find logs at: /nas-ctm01/homes/mipaiva/pipeline_template_pl/experiment_results/experiment_122/version_2/wandb/run-20250528_030423-mm066d2r/logs
wandb: Tracking run with wandb version 0.19.11
wandb: Run data is saved locally in /nas-ctm01/homes/mipaiva/pipeline_template_pl/experiment_results/experiment_122/version_3/wandb/run-20250528_072316-u2qwtowx
wandb: Run `wandb offline` to turn off syncing.
wandb: Syncing run resnet50_3d_122_3_fold1
wandb: ⭐️ View project at https://wandb.ai/maria-i-paiva-inesc-tec/comparative_study_3d_norm_resize
wandb: 🚀 View run at https://wandb.ai/maria-i-paiva-inesc-tec/comparative_study_3d_norm_resize/runs/u2qwtowx
...model pipeline for data fold 1 has run!
Saving execution datetimes to /nas-ctm01/homes/mipaiva/pipeline_template_pl/experiment_results/experiment_122/version_2/execution_datetimes.json

**************************************************  Experiment 122 | Version 3 **************************************************
Label column '5y' found in metadata. Available columns: ['pid', 'study_yr', 'path', 'sct_slice_num_og', 'stage', '1y', '2y', '5y', '10y', 'fup_days', 'sct_nod_err']
[INFO] Train dataloader 0 label distribution: 0: 216, 1: 72
[INFO] Validation dataloader 0 label distribution: 0: 24, 1: 8
[INFO] Test dataloader 0 label distribution: 0: 60, 1: 20

Running model pipeline for data fold 1...
Label column '5y' found in metadata. Available columns: ['pid', 'study_yr', 'path', 'sct_slice_num_og', 'stage', '1y', '2y', '5y', '10y', 'fup_days', 'sct_nod_err']
/nas-ctm01/homes/mipaiva/.conda/envs/pipeline/lib/python3.11/site-packages/torchmetrics/utilities/prints.py:43: UserWarning: No negative samples in targets, false positive value should be meaningless. Returning zero tensor in false positive score
  warnings.warn(*args, **kwargs)
/nas-ctm01/homes/mipaiva/.conda/envs/pipeline/lib/python3.11/site-packages/torchmetrics/utilities/prints.py:43: UserWarning: No positive samples in targets, true positive value should be meaningless. Returning zero tensor in true positive score
  warnings.warn(*args, **kwargs)
/nas-ctm01/homes/mipaiva/.conda/envs/pipeline/lib/python3.11/site-packages/sklearn/metrics/_classification.py:407: UserWarning: A single label was found in 'y_true' and 'y_pred'. For the confusion matrix to have the correct shape, use the 'labels' parameter to pass all known labels.
  warnings.warn(
wandb:                                                                                
wandb: 
wandb: Run history:
wandb:          test_accuracy █▁██████████████████████████████████████
wandb:             test_auroc ▁▇▄▅▆▆▇▄▅▆▆▆▇▆▆▆▅▆▅▆▅▄▅▅▄▅▄▅▄▅▃▄▄▅▅▄▄▄██
wandb: test_balanced_accuracy ▁▁▁▁▁▁▁▁▁▁▁▁▁▁▁▁▁▁▁▁▁▁▁▁▁▁▁▁▁▁▁▁▁▁▁▁▁▁▁▁
wandb:         test_precision ▁▁▁▁▁▁▁▁▁▁▁▁▁▁▁▁▁▁▁▁▁▁▁▁▁▁▁▁▁▁▁▁▁▁▁▁▁▁▁▁
wandb:            test_recall ▁███▃███████████████████████████████▁███
wandb:            train_auroc ▇▅▆▅█▅▁▄▆▅▃▅▄▄▆▅▆▁▄▄▅▆▆▅▇█▁▂▇▄▃▂▁▃▃▄▅█▆▃
wandb:             train_loss ▆▄▄▂▂▃▂▂▃▂▂▁▂▂▂▂▂▂▂▂▂▄█▂▂▂▂▃▂▂▁▂▂▂▂▂▂▂▂▁
wandb:           val_accuracy ████████████████████████████████████▁███
wandb:              val_auroc ▅▄▆█▄▆█▂▄▄▅▅▄▆▅▇▆▆▃▄▂▁▅▄▃▃▄▃▅▅▇▄▇▄▃▇▂▆▁▅
wandb:  val_balanced_accuracy ▁▁▁▁▁▁▁▁▁▁▁▁▁▁▁▁▁▁▁▁▁▁▁▁▁▁▁▁▁▁▁▁▁▁▁▁▁▁▁▁
wandb:               val_loss █▆▄▃▄▄▃▁▂▂▃▄▄▁▁▇▁▂▂▂▂▁▁▁▁▂▂▁▁▁▂▂▄▃▂▃▁▁▁▁
wandb:          val_precision █▁██████████████████████████████████▁███
wandb:             val_recall ▁▁▁▁▁▁▁▁▁▁▁▁▁▁▁▁▁▁▁▁▁▁▁▁▁▁▁▁▁▁▁▁▁▁▁▁▁▁▁▁
wandb: 
wandb: Run summary:
wandb:          test_accuracy 0.75
wandb:             test_auroc 0.6075
wandb: test_balanced_accuracy 0.5
wandb:         test_precision 0.75
wandb:            test_recall 0.75
wandb:            train_auroc 0.44959
wandb:             train_loss 0.65577
wandb:           val_accuracy 0.75
wandb:              val_auroc 0.44271
wandb:  val_balanced_accuracy 0.5
wandb:               val_loss 0.66617
wandb:          val_precision 0.75
wandb:             val_recall 0.75
wandb: 
wandb: 🚀 View run resnet50_3d_122_3_fold1 at: https://wandb.ai/maria-i-paiva-inesc-tec/comparative_study_3d_norm_resize/runs/u2qwtowx
wandb: ⭐️ View project at: https://wandb.ai/maria-i-paiva-inesc-tec/comparative_study_3d_norm_resize
wandb: Synced 5 W&B file(s), 0 media file(s), 0 artifact file(s) and 0 other file(s)
wandb: Find logs at: /nas-ctm01/homes/mipaiva/pipeline_template_pl/experiment_results/experiment_122/version_3/wandb/run-20250528_072316-u2qwtowx/logs
wandb: Tracking run with wandb version 0.19.11
wandb: Run data is saved locally in /nas-ctm01/homes/mipaiva/pipeline_template_pl/experiment_results/experiment_122/version_4/wandb/run-20250528_100708-ko45puhx
wandb: Run `wandb offline` to turn off syncing.
wandb: Syncing run resnet50_3d_122_4_fold1
wandb: ⭐️ View project at https://wandb.ai/maria-i-paiva-inesc-tec/comparative_study_3d_norm_resize
wandb: 🚀 View run at https://wandb.ai/maria-i-paiva-inesc-tec/comparative_study_3d_norm_resize/runs/ko45puhx
...model pipeline for data fold 1 has run!
Saving execution datetimes to /nas-ctm01/homes/mipaiva/pipeline_template_pl/experiment_results/experiment_122/version_3/execution_datetimes.json

**************************************************  Experiment 122 | Version 4 **************************************************
Label column '5y' found in metadata. Available columns: ['pid', 'study_yr', 'path', 'sct_slice_num_og', 'stage', '1y', '2y', '5y', '10y', 'fup_days', 'sct_nod_err']
[INFO] Train dataloader 0 label distribution: 0: 216, 1: 72
[INFO] Validation dataloader 0 label distribution: 0: 24, 1: 8
[INFO] Test dataloader 0 label distribution: 0: 60, 1: 20

Running model pipeline for data fold 1...
Label column '5y' found in metadata. Available columns: ['pid', 'study_yr', 'path', 'sct_slice_num_og', 'stage', '1y', '2y', '5y', '10y', 'fup_days', 'sct_nod_err']
/nas-ctm01/homes/mipaiva/.conda/envs/pipeline/lib/python3.11/site-packages/torchmetrics/utilities/prints.py:43: UserWarning: No negative samples in targets, false positive value should be meaningless. Returning zero tensor in false positive score
  warnings.warn(*args, **kwargs)
/nas-ctm01/homes/mipaiva/.conda/envs/pipeline/lib/python3.11/site-packages/torchmetrics/utilities/prints.py:43: UserWarning: No positive samples in targets, true positive value should be meaningless. Returning zero tensor in true positive score
  warnings.warn(*args, **kwargs)
/nas-ctm01/homes/mipaiva/.conda/envs/pipeline/lib/python3.11/site-packages/sklearn/metrics/_classification.py:407: UserWarning: A single label was found in 'y_true' and 'y_pred'. For the confusion matrix to have the correct shape, use the 'labels' parameter to pass all known labels.
  warnings.warn(
srun: got SIGCONT
slurmstepd-01.ctm-deep-08: error: *** JOB 6919 ON 01.ctm-deep-08 CANCELLED AT 2025-05-28T11:49:36 ***
srun: forcing job termination
slurmstepd-01.ctm-deep-08: error: *** STEP 6919.0 ON 01.ctm-deep-08 CANCELLED AT 2025-05-28T11:49:36 ***
srun: Job step aborted: Waiting up to 32 seconds for job step to finish.
