Initialization time: 2025-05-26 23:50:39
wandb: Currently logged in as: maria-i-paiva (maria-i-paiva-inesc-tec) to https://api.wandb.ai. Use `wandb login --relogin` to force relogin
wandb: WARNING Using a boolean value for 'reinit' is deprecated. Use 'return_previous' or 'finish_previous' instead.
wandb: Tracking run with wandb version 0.19.11
wandb: Run data is saved locally in /nas-ctm01/homes/mipaiva/pipeline_template_pl/experiment_results/experiment_107/version_160/wandb/run-20250526_235050-ixn5s0a9
wandb: Run `wandb offline` to turn off syncing.
wandb: Syncing run resnet50_2d_107_160_fold1
wandb: ⭐️ View project at https://wandb.ai/maria-i-paiva-inesc-tec/comparative_study_2d_norm_resize_fix_auc
wandb: 🚀 View run at https://wandb.ai/maria-i-paiva-inesc-tec/comparative_study_2d_norm_resize_fix_auc/runs/ixn5s0a9
/nas-ctm01/homes/mipaiva/.conda/envs/pipeline/lib/python3.11/site-packages/lightning_fabric/loggers/csv_logs.py:195: UserWarning: Experiment logs directory /nas-ctm01/homes/mipaiva/pipeline_template_pl/experiment_results/experiment_107/version_160/datafold_ exists and is not empty. Previous log files in this directory will be deleted when the new ones are saved!
  rank_zero_warn(
/nas-ctm01/homes/mipaiva/.conda/envs/pipeline/lib/python3.11/site-packages/pytorch_lightning/callbacks/model_checkpoint.py:617: UserWarning: Checkpoint directory /nas-ctm01/homes/mipaiva/pipeline_template_pl/experiment_results/experiment_107/version_160/datafold_1/models exists and is not empty.
  rank_zero_warn(f"Checkpoint directory {dirpath} exists and is not empty.")

**************************************************  Experiment 107 | Version 160 **************************************************
Label column '5y' found in metadata. Available columns: ['pid', 'study_yr', 'path', 'sct_slice_num_og', 'stage', '1y', '2y', '5y', '10y', 'fup_days', 'sct_nod_err']
[INFO] Train dataloader 0 label distribution: 0: 213, 1: 70
[INFO] Validation dataloader 0 label distribution: 0: 24, 1: 8
[INFO] Test dataloader 0 label distribution: 0: 59, 1: 20

Running model pipeline for data fold 1...
Label column '5y' found in metadata. Available columns: ['pid', 'study_yr', 'path', 'sct_slice_num_og', 'stage', '1y', '2y', '5y', '10y', 'fup_days', 'sct_nod_err']
wandb:                                                                                
wandb: 
wandb: Run history:
wandb:          test_accuracy ▃▁▁██▂▂███▄█▁█▂▃▃█▂▃██▁█▃▃▇█▁▂█▁▇██▇▁▁▇█
wandb:             test_auroc ▃▂▃▂▄▄▃▂▅▅▅█▁▄▅▂▂▅▁▄▃▃▃▅▆▃▃▃▅▆▇▅▄▃▃▇▆▃▇▄
wandb: test_balanced_accuracy ▃▃▃▄▃▃▄▃▃▃▃▅▄▄▂▃▃▃▄▃▅▃▅▅▄▄█▃▃▃▄▂▁▃▃▃▃▃▃▃
wandb:         test_precision █▃▁▁▁▁▁██▄▂██▂█▂▁█▃▁▃█▃▃▂▁█▄▄▃██▇▇▇█▁▁▇█
wandb:            test_recall ▁██████████▃▃▃█▃▃████▄▄▁▆▃█▁▁▁▇▇▇▁▁██▃▁▇
wandb:            train_auroc ▁▂▄▃▅▅▄▃▄▆▃█▅▅▅▅▃▁▄▅█▂▁▄█▅▄▄▄▂▂▄▁▁▃▄▆▅▂▆
wandb:             train_loss ▇▅▅▆▅▅▄▄▄▆▅▅▅▄▄▅▃▃▃▄▅▅▅▅▅▄▄▃▄▃▅▄█▁▅▅▅▄▆▄
wandb:           val_accuracy ██▃▁█▁█▃████▂██▁█▃▁▁█▂▁▂█▁█▃▄█▂█▁█▇██▁▁▇
wandb:              val_auroc ▂▁▅▇▂▅▃▅▂█▅▆▆▆▅▂▄▆▇▇▃▄▃▃▅▂▄▇▇▄▃▃▅▄▃▄▂▄▅▄
wandb:  val_balanced_accuracy ▄▃▄▄▄▄▄▄▆▄▁▄▄▄▄▄▁▄▄▁▅▃▃▂▄▂█▁▆▆▃▁▄▁▄▂▁▄▄▇
wandb:               val_loss ▁▁▁▁▁▁▁▁▁▁▁▁▁▁▁▁▂▂▂▂▃▁▁▁▁▁▁▁▂▂█▁▁▁▁▁▁▁▁▁
wandb:          val_precision █▃▁▁██▁███▁███▂█▃▂▁▁██▂███▁▄███▁██▂█▁▁▁█
wandb:             val_recall ▂▃▁▁▁▁█████▁█▁▁▃██▁▂▂▁▁▅▂▁▁▁▁██▂▇▇█▂██▁▇
wandb: 
wandb: Run summary:
wandb:          test_accuracy 0.73418
wandb:             test_auroc 0.55085
wandb: test_balanced_accuracy 0.50805
wandb:         test_precision 0.73418
wandb:            test_recall 0.73418
wandb:            train_auroc 0.58598
wandb:             train_loss 0.68673
wandb:           val_accuracy 0.78125
wandb:              val_auroc 0.52083
wandb:  val_balanced_accuracy 0.5625
wandb:               val_loss 0.7073
wandb:          val_precision 0.78125
wandb:             val_recall 0.78125
wandb: 
wandb: 🚀 View run resnet50_2d_107_160_fold1 at: https://wandb.ai/maria-i-paiva-inesc-tec/comparative_study_2d_norm_resize_fix_auc/runs/ixn5s0a9
wandb: ⭐️ View project at: https://wandb.ai/maria-i-paiva-inesc-tec/comparative_study_2d_norm_resize_fix_auc
wandb: Synced 5 W&B file(s), 0 media file(s), 0 artifact file(s) and 0 other file(s)
wandb: Find logs at: /nas-ctm01/homes/mipaiva/pipeline_template_pl/experiment_results/experiment_107/version_160/wandb/run-20250526_235050-ixn5s0a9/logs
wandb: Tracking run with wandb version 0.19.11
wandb: Run data is saved locally in /nas-ctm01/homes/mipaiva/pipeline_template_pl/experiment_results/experiment_107/version_160/wandb/run-20250527_054102-zuhrrmff
wandb: Run `wandb offline` to turn off syncing.
wandb: Syncing run resnet50_2d_107_160_fold1
wandb: ⭐️ View project at https://wandb.ai/maria-i-paiva-inesc-tec/comparative_study_2d_norm_resize_fix_auc
wandb: 🚀 View run at https://wandb.ai/maria-i-paiva-inesc-tec/comparative_study_2d_norm_resize_fix_auc/runs/zuhrrmff
/nas-ctm01/homes/mipaiva/.conda/envs/pipeline/lib/python3.11/site-packages/lightning_fabric/loggers/csv_logs.py:195: UserWarning: Experiment logs directory /nas-ctm01/homes/mipaiva/pipeline_template_pl/experiment_results/experiment_107/version_160/datafold_ exists and is not empty. Previous log files in this directory will be deleted when the new ones are saved!
  rank_zero_warn(
/nas-ctm01/homes/mipaiva/.conda/envs/pipeline/lib/python3.11/site-packages/pytorch_lightning/callbacks/model_checkpoint.py:617: UserWarning: Checkpoint directory /nas-ctm01/homes/mipaiva/pipeline_template_pl/experiment_results/experiment_107/version_160/datafold_1/models exists and is not empty.
  rank_zero_warn(f"Checkpoint directory {dirpath} exists and is not empty.")
...model pipeline for data fold 1 has run!
Saving execution datetimes to /nas-ctm01/homes/mipaiva/pipeline_template_pl/experiment_results/experiment_107/version_160/execution_datetimes.json

**************************************************  Experiment 107 | Version 160 **************************************************
Label column '5y' found in metadata. Available columns: ['pid', 'study_yr', 'path', 'sct_slice_num_og', 'stage', '1y', '2y', '5y', '10y', 'fup_days', 'sct_nod_err']
[INFO] Train dataloader 0 label distribution: 0: 213, 1: 70
[INFO] Validation dataloader 0 label distribution: 0: 24, 1: 8
[INFO] Test dataloader 0 label distribution: 0: 59, 1: 20

Running model pipeline for data fold 1...
Label column '5y' found in metadata. Available columns: ['pid', 'study_yr', 'path', 'sct_slice_num_og', 'stage', '1y', '2y', '5y', '10y', 'fup_days', 'sct_nod_err']
Error executing job with overrides: []
Traceback (most recent call last):
  File "/nas-ctm01/homes/mipaiva/pipeline_template_pl/slurm_files/shell_script_files/../../src/scripts/run_experiment_pipeline.py", line 54, in run_hyperparameter_grid_based_execution_pipeline
    run_experiment_pipeline(config)
  File "/nas-ctm01/homes/mipaiva/pipeline_template_pl/slurm_files/shell_script_files/../../src/scripts/run_experiment_pipeline.py", line 165, in run_experiment_pipeline
    model_pipeline.train_model()
  File "/nas-ctm01/homes/mipaiva/pipeline_template_pl/src/modules/model/model_pipeline.py", line 68, in train_model
    self.pytorch_lig